{
  "schemaVersion": 1,
  "suite": "container_header",
  "title": "PFB 分块容器文件头（§3.3，2026-09-17 裁决的唯一 v1）",
  "description": "锁定 128 字节头部的字节布局（48 固定 + 变量区）、CRC32、featureFlags 位语义与四类错误分流。期望值由 Python 独立实现生成。",
  "cases": [
    {
      "id": "container.header.encode.default-full",
      "kind": "container.header.encode",
      "title": "默认参数与 GZIP+CHUNKED 标志下的 128 字节头部字节",
      "milestone": "M1",
      "input": {
        "kdf": {
          "m": 65536,
          "t": 3,
          "p": 1,
          "saltLength": 16,
          "outputLength": 32
        },
        "featureFlags": 7,
        "minReaderVersion": 1,
        "chunkPlainSizeKiB": 1024,
        "plaintextLength": 251658240,
        "chunkCount": 240,
        "saltHex": "101112131415161718191a1b1c1d1e1f",
        "noncePrefixHex": "a0a1a2a3a4a5a6a7",
        "volumeSetIdHex": "0001020304050607",
        "volumeIndex": 1,
        "volumeTotal": 1,
        "setDigestHex": "0000000000000000000000000000000000000000000000000000000000000000"
      },
      "expect": {
        "ok": true,
        "value": {
          "hex": "5046424f4f4b0100000100010007010100010000000000030120001000080400000000000f000000000000f0e69e9c84101112131415161718191a1b1c1d1e1fa0a1a2a3a4a5a6a7a0a1a2a3a4a5a6a7000000000001020304050607000100010000000000000000000000000000000000000000000000000000000000000000",
          "lengthBytes": 128,
          "crc32Hex": "E69E9C84",
          "headerSha256Hex": "ef942f75956254d8b1c10f77bb48d98e5dd03094dfeb08ae62ba86ffadf0d40d"
        }
      },
      "notes": "这是发布格式的第一个字节序快照。任何让这串十六进制变化的改动都会让已导出的旧文件失去可读性，必须走格式主版本升级，而不是直接改。",
      "tags": [
        "format",
        "security"
      ]
    },
    {
      "id": "container.header.encode.attachments-incremental-multivolume",
      "kind": "container.header.encode",
      "title": "HAS_ATTACH + INCREMENTAL + 多卷（2/3）与非零 setDigest 的头部",
      "milestone": "M1",
      "input": {
        "kdf": {
          "m": 65536,
          "t": 3,
          "p": 1,
          "saltLength": 16,
          "outputLength": 32
        },
        "featureFlags": 61,
        "minReaderVersion": 1,
        "chunkPlainSizeKiB": 1024,
        "plaintextLength": 0,
        "chunkCount": 0,
        "saltHex": "101112131415161718191a1b1c1d1e1f",
        "noncePrefixHex": "a0a1a2a3a4a5a6a7",
        "volumeSetIdHex": "0001020304050607",
        "volumeIndex": 2,
        "volumeTotal": 3,
        "setDigestHex": "9f9f9f9f9f9f9f9f9f9f9f9f9f9f9f9f9f9f9f9f9f9f9f9f9f9f9f9f9f9f9f9f"
      },
      "expect": {
        "ok": true,
        "value": {
          "hex": "5046424f4f4b010000010001003d01010001000000000003012000100008040000000000000000000000000001017a6f101112131415161718191a1b1c1d1e1fa0a1a2a3a4a5a6a7a0a1a2a3a4a5a6a7000000000001020304050607000200039f9f9f9f9f9f9f9f9f9f9f9f9f9f9f9f9f9f9f9f9f9f9f9f9f9f9f9f9f9f9f9f",
          "lengthBytes": 128,
          "crc32Hex": "01017A6F",
          "headerSha256Hex": "8c820b5fd4f0ce1c9306cbcf1d007017207f6cefda2b0945ea783cbede3bfbee"
        }
      },
      "notes": "变长区的 setDigest 参与 AAD 基础摘要（SHA256 头 128 字节）——这条向量把「变量区也在 AAD 保护范围内」钉死。",
      "tags": [
        "format",
        "security"
      ]
    },
    {
      "id": "container.header.decode.roundtrip",
      "kind": "container.header.decode",
      "title": "解析合法头部并还原全部字段",
      "milestone": "M1",
      "input": {
        "hex": "5046424f4f4b0100000100010007010100010000000000030120001000080400000000000f000000000000f0e69e9c84101112131415161718191a1b1c1d1e1fa0a1a2a3a4a5a6a7a0a1a2a3a4a5a6a7000000000001020304050607000100010000000000000000000000000000000000000000000000000000000000000000"
      },
      "expect": {
        "ok": true,
        "value": {
          "formatVersion": 1,
          "minReaderVersion": 1,
          "featureFlags": 7,
          "kdfMemoryKiB": 65536,
          "kdfIterations": 3,
          "kdfParallelism": 1,
          "kdfSaltLen": 16,
          "noncePrefixLen": 8,
          "chunkPlainSizeKiB": 1024,
          "plaintextLength": 251658240,
          "chunkCount": 240,
          "saltHex": "101112131415161718191a1b1c1d1e1f",
          "noncePrefixHex": "a0a1a2a3a4a5a6a7",
          "volumeSetIdHex": "0001020304050607",
          "volumeIndex": 1,
          "volumeTotal": 1,
          "setDigestHex": "0000000000000000000000000000000000000000000000000000000000000000"
        }
      },
      "notes": "解析必须逐字段还原；宽松解析会让拼写错误变成假绿灯。",
      "tags": [
        "format"
      ]
    },
    {
      "id": "container.header.decode.crc-tampered",
      "kind": "container.header.decode",
      "title": "头部一个字节被改且未重算 CRC → 结构损坏",
      "milestone": "M1",
      "input": {
        "hex": "5046424f4f4b0100000101010007010100010000000000030120001000080400000000000f000000000000f0e69e9c84101112131415161718191a1b1c1d1e1fa0a1a2a3a4a5a6a7a0a1a2a3a4a5a6a7000000000001020304050607000100010000000000000000000000000000000000000000000000000000000000000000"
      },
      "expect": {
        "ok": false,
        "errorCode": "PFB_E_HEADER_INVALID"
      },
      "notes": "CRC 先于字段语义校验。没有这一层，被篡改的头部可能被解释成「合法但奇怪的文件」，为后续攻击铺路。",
      "tags": [
        "security",
        "format"
      ]
    },
    {
      "id": "container.header.decode.magic-wrong",
      "kind": "container.header.decode",
      "title": "魔数不符 → 不是本格式",
      "milestone": "M1",
      "input": {
        "hex": "504642304f4b0100000100010007010100010000000000030120001000080400000000000f000000000000f0e69e9c84101112131415161718191a1b1c1d1e1fa0a1a2a3a4a5a6a7a0a1a2a3a4a5a6a7000000000001020304050607000100010000000000000000000000000000000000000000000000000000000000000000"
      },
      "expect": {
        "ok": false,
        "errorCode": "PFB_E_MAGIC"
      },
      "notes": "选错文件的第一道分流；必须在读任何参数之前拒绝。",
      "tags": [
        "security",
        "format"
      ]
    },
    {
      "id": "container.header.decode.version-too-new",
      "kind": "container.header.decode",
      "title": "formatVersion=2（CRC 正确）→ 版本不兼容",
      "milestone": "M1",
      "input": {
        "hex": "5046424f4f4b0100000200010007010100010000000000030120001000080400000000000f000000000000f06d4da29d101112131415161718191a1b1c1d1e1fa0a1a2a3a4a5a6a7a0a1a2a3a4a5a6a7000000000001020304050607000100010000000000000000000000000000000000000000000000000000000000000000"
      },
      "expect": {
        "ok": false,
        "errorCode": "PFB_E_VERSION_UNSUPPORTED"
      },
      "notes": "CRC 修好之后版本分支才轮得到 —— 这条向量确认两个分支互不遮蔽。",
      "tags": [
        "forward-compat",
        "format"
      ]
    },
    {
      "id": "container.header.decode.unknown-flag-bit",
      "kind": "container.header.decode",
      "title": "未知 flag 位（bit11，CRC 正确）→ 拒绝解析",
      "milestone": "M1",
      "input": {
        "hex": "5046424f4f4b0100000100010807010100010000000000030120001000080400000000000f000000000000f0058aa8d0101112131415161718191a1b1c1d1e1fa0a1a2a3a4a5a6a7a0a1a2a3a4a5a6a7000000000001020304050607000100010000000000000000000000000000000000000000000000000000000000000000"
      },
      "expect": {
        "ok": false,
        "errorCode": "PFB_E_HEADER_INVALID"
      },
      "notes": "未知位意味着「来自更新的次版本」。本实现无法安全解释它，静默忽略会把未知语义当成已知语义。",
      "tags": [
        "forward-compat",
        "security"
      ]
    }
  ]
}
